{
  "schemaVersion": "1.0",
  "testId": "CT-UC017-POS-01",
  "operation": "evaluate_resource_profile",
  "input": {
    "minimumCapabilities": {"memoryMiB": 256, "batteryPercent": 10},
    "deviceCapabilities": {"memoryMiB": 512, "batteryPercent": 80},
    "ceiling": {"memoryMiB": 192, "provingTimeMs": 3000, "batteryPercent": 4},
    "measurement": {"memoryMiB": 128, "provingTimeMs": 2200, "batteryPercent": 2}
  }
}
